{
  "estilo": "boykisser-uwu",
  "nombre": "KOBO.EXE: boykisser uwu",
  "version": "0.1",
  "formato": {
    "tarjeta_mm": [90, 50],
    "tarjeta_px_css": [900, 500],
    "impresion_dpi": 300,
    "sangrado_mm": 3,
    "canva_px": [340, 189]
  },
  "color": {
    "crema_leche": "#FFF8EE",
    "blanco_gatito": "#FFFFFF",
    "rosa_algodon": "#FFE4EE",
    "rosa_bebe": "#FFC8DD",
    "rosa_chicle": "#FF8FB8",
    "rubor": "#E5484D",
    "azul_bebe": "#BDE0FE",
    "azul_cielo": "#8EC5FF",
    "lila": "#CDB4DB",
    "brillo": "#FFE58F",
    "tinta": "#2B2233",
    "tinta_suave": "#6B5B73",
    "sintaxis_clave": "#E0559B",
    "sintaxis_cadena": "#3D8BD9",
    "sintaxis_numero": "#9B6BD1",
    "sintaxis_tipo": "#2E9E8F",
    "sintaxis_comentario": "#B49BB0"
  },
  "degradados": {
    "liston": ["#FFC8DD", "#FF8FB8"],
    "femboy": ["#FFC8DD", "#FFFFFF", "#BDE0FE"],
    "holo": ["#FFC8DD", "#CDB4DB", "#BDE0FE", "#FFE58F"]
  },
  "tipografia": {
    "max_fuentes_por_cara": 4,
    "roles": {
      "titular_burbuja": ["Burbuja"],
      "plumon": ["Plumon"],
      "acento_liston": ["Lazo"],
      "codigo": ["Code"],
      "pixel_diminuto": ["Silk"]
    }
  },
  "antirreglas": {
    "rotacion_stickers_grados": [-8, 7],
    "rotacion_titulares_grados": [-4, 3],
    "rebote_letras": {"grados": 3, "px": 2},
    "washi": {"px": [[70, 110], 22], "grados": [12, 18], "opacidad": 0.75, "por_cara": 2},
    "brillitos": {"por_cara": [5, 9], "px": [6, 22]},
    "moños_por_cara": 1,
    "marco_plumon_px": [3, 4],
    "patron_fondo_opacidad_max": 0.12
  },
  "efectos_imagen": {
    "sticker": {"borde_px": 16, "sombra": [255, 143, 184, 150], "sombra_off": [7, 9], "cierre_px": [3, 6]},
    "silueta": {"umbral": 225, "cierre_px": 5},
    "codigo_con_forma": {"fuente": "Code", "px": [8, 10], "interlinea": 1.25}
  },
  "intocables": [
    "@KoboTheWolf legible en tinta sobre fondo claro, recto, mínimo 9 pt",
    "QR a https://t.me/KoboTheWolf limpio, recto, sin decoración encima",
    "sin errores de ortografía en datos de contacto (los errores tiernos solo en frases)",
    "el gatito conserva línea negra y cuerpo blanco",
    "crédito a artistas conocidos"
  ],
  "contacto": {"telegram": "@KoboTheWolf", "url": "https://t.me/KoboTheWolf"}
}
